          {
            "cod_oferta": "1234"
            , "empresa": "EmpresaEjemplo"
            , "localidad": "Valencia"
            , "jornada": "flexible"
            , "duracion": "36 meses"
            , "bolsa": "300â‚¬"
            , "fecha_inicio": "31-01-2017"
            , "num_plazas": "20"
          }